[
  {
    "id": "omarchy.active-window",
    "name": "Active window",
    "description": "Title of the focused window",
    "kinds": [
      "bar-widget"
    ],
    "firstParty": true,
    "manifestPath": "/usr/share/omarchy/shell/plugins/bar/widgets/ActiveWindow.manifest.json",
    "sourceDir": "/usr/share/omarchy/shell/plugins/bar/widgets",
    "entryPoints": {
      "barWidget": "ActiveWindow.qml"
    },
    "barWidget": {
      "displayName": "Active window",
      "description": "Title of the focused window",
      "category": "Compositor",
      "allowMultiple": false,
      "defaultSection": "left"
    },
    "bar": null,
    "barWidgetPath": "/usr/share/omarchy/shell/plugins/bar/widgets/ActiveWindow.qml",
    "barPath": null
  },
  {
    "id": "omarchy.agents",
    "name": "Agents",
    "description": "Claude Code, Codex, and Fireworks usage, limits, and pace in a native Omarchy bar panel.",
    "kinds": [
      "bar-widget"
    ],
    "firstParty": true,
    "manifestPath": "/usr/share/omarchy/shell/plugins/agents/manifest.json",
    "sourceDir": "/usr/share/omarchy/shell/plugins/agents",
    "entryPoints": {
      "barWidget": "Panel.qml"
    },
    "barWidget": {
      "displayName": "Agents",
      "description": "One bar icon and one panel: rate-limit meters with pace, today, the last week, and the all-time model breakdown for every subscription.",
      "category": "AI",
      "aliases": [
        "agents",
        "model-usage"
      ],
      "allowMultiple": false,
      "defaults": {
        "providers": {
          "claude": {
            "enabled": true
          },
          "codex": {
            "enabled": true
          },
          "fireworks": {
            "enabled": true
          }
        },
        "refreshIntervalSec": 900,
        "syncMode": "Off",
        "syncDir": "",
        "syncFileName": "",
        "syncDeviceId": ""
      },
      "schema": [
        {
          "key": "refreshIntervalSec",
          "type": "integer",
          "label": "Refresh interval (seconds)",
          "min": 30,
          "max": 3600,
          "step": 30,
          "defaultValue": 900
        },
        {
          "key": "syncMode",
          "type": "enum",
          "label": "Synced aggregation",
          "options": [
            "Off",
            "On"
          ],
          "defaultValue": "Off",
          "description": "When On, write this machine's local usage snapshot and merge snapshots from other machines."
        },
        {
          "key": "syncDir",
          "type": "path",
          "label": "Sync folder",
          "defaultValue": "",
          "description": "A folder synced by Syncthing, Dropbox, rsync, etc."
        },
        {
          "key": "syncFileName",
          "type": "string",
          "label": "Snapshot file name",
          "defaultValue": "",
          "description": "Optional. Defaults to <hostname>.json. Use a different file name on each machine, such as laptop.json or desktop.json."
        },
        {
          "key": "syncDeviceId",
          "type": "string",
          "label": "Device id",
          "defaultValue": "",
          "description": "Optional stable device name used inside synced aggregate snapshots."
        }
      ]
    },
    "bar": null,
    "barWidgetPath": "/usr/share/omarchy/shell/plugins/agents/Panel.qml",
    "barPath": null
  },
  {
    "id": "omarchy.audio",
    "name": "Audio",
    "description": "Volume slider, output picker, per-app mixer",
    "kinds": [
      "bar-widget"
    ],
    "firstParty": true,
    "manifestPath": "/usr/share/omarchy/shell/plugins/panels/audio/manifest.json",
    "sourceDir": "/usr/share/omarchy/shell/plugins/panels/audio",
    "entryPoints": {
      "barWidget": "Panel.qml"
    },
    "barWidget": {
      "displayName": "Audio",
      "description": "Volume slider, output picker, per-app mixer",
      "category": "Audio",
      "allowMultiple": false
    },
    "bar": null,
    "barWidgetPath": "/usr/share/omarchy/shell/plugins/panels/audio/Panel.qml",
    "barPath": null
  },
  {
    "id": "omarchy.background",
    "name": "Background",
    "description": "Desktop background renderer with click handling and transitions",
    "kinds": [
      "service"
    ],
    "firstParty": true,
    "manifestPath": "/usr/share/omarchy/shell/plugins/background/manifest.json",
    "sourceDir": "/usr/share/omarchy/shell/plugins/background",
    "entryPoints": {
      "service": "Background.qml"
    },
    "barWidget": null,
    "bar": null,
    "barWidgetPath": null,
    "barPath": null
  },
  {
    "id": "omarchy.bar",
    "name": "Bar",
    "description": "Status bar with widgets",
    "kinds": [
      "bar"
    ],
    "firstParty": true,
    "manifestPath": "/usr/share/omarchy/shell/plugins/bar/manifest.json",
    "sourceDir": "/usr/share/omarchy/shell/plugins/bar",
    "entryPoints": {
      "bar": "Bar.qml"
    },
    "barWidget": null,
    "bar": null,
    "barWidgetPath": null,
    "barPath": "/usr/share/omarchy/shell/plugins/bar/Bar.qml"
  },
  {
    "id": "omarchy.battery",
    "name": "Battery",
    "description": "Low battery warning service",
    "kinds": [
      "service"
    ],
    "firstParty": true,
    "manifestPath": "/usr/share/omarchy/shell/plugins/services/battery/manifest.json",
    "sourceDir": "/usr/share/omarchy/shell/plugins/services/battery",
    "entryPoints": {
      "service": "Service.qml"
    },
    "barWidget": null,
    "bar": null,
    "barWidgetPath": null,
    "barPath": null
  },
  {
    "id": "omarchy.bluetooth",
    "name": "Bluetooth",
    "description": "Bluetooth device list with connect/disconnect",
    "kinds": [
      "bar-widget"
    ],
    "firstParty": true,
    "manifestPath": "/usr/share/omarchy/shell/plugins/panels/bluetooth/manifest.json",
    "sourceDir": "/usr/share/omarchy/shell/plugins/panels/bluetooth",
    "entryPoints": {
      "barWidget": "Panel.qml"
    },
    "barWidget": {
      "displayName": "Bluetooth",
      "description": "Bluetooth device list with connect/disconnect",
      "category": "Network",
      "allowMultiple": false
    },
    "bar": null,
    "barWidgetPath": "/usr/share/omarchy/shell/plugins/panels/bluetooth/Panel.qml",
    "barPath": null
  },
  {
    "id": "omarchy.clipboard",
    "name": "Clipboard",
    "description": "A clipboard manager to view and paste history",
    "kinds": [
      "overlay"
    ],
    "firstParty": true,
    "manifestPath": "/usr/share/omarchy/shell/plugins/clipboard/manifest.json",
    "sourceDir": "/usr/share/omarchy/shell/plugins/clipboard",
    "entryPoints": {
      "overlay": "Clipboard.qml"
    },
    "barWidget": null,
    "bar": null,
    "barWidgetPath": null,
    "barPath": null
  },
  {
    "id": "omarchy.clock",
    "name": "Clock",
    "description": "Date/time label with a calendar popup",
    "kinds": [
      "bar-widget"
    ],
    "firstParty": true,
    "manifestPath": "/usr/share/omarchy/shell/plugins/panels/clock/manifest.json",
    "sourceDir": "/usr/share/omarchy/shell/plugins/panels/clock",
    "entryPoints": {
      "barWidget": "BarWidget.qml"
    },
    "barWidget": {
      "displayName": "Clock",
      "description": "Date/time label with a calendar popup",
      "category": "Time",
      "allowMultiple": false
    },
    "bar": null,
    "barWidgetPath": "/usr/share/omarchy/shell/plugins/panels/clock/BarWidget.qml",
    "barPath": null
  },
  {
    "id": "omarchy.dev-gallery",
    "name": "Dev gallery",
    "description": "Visual reference for omarchy-shell common UI components. Summon with: omarchy-shell shell summon omarchy.dev-gallery '{}' (or run: omarchy dev ui-preview).",
    "kinds": [
      "panel"
    ],
    "firstParty": true,
    "manifestPath": "/usr/share/omarchy/shell/plugins/dev-gallery/manifest.json",
    "sourceDir": "/usr/share/omarchy/shell/plugins/dev-gallery",
    "entryPoints": {
      "panel": "GalleryPanel.qml"
    },
    "barWidget": null,
    "bar": null,
    "barWidgetPath": null,
    "barPath": null
  },
  {
    "id": "omarchy.disk-speedtest",
    "name": "Disk speed test",
    "description": "Live disk write and read speed dials. Summon with: omarchy-shell shell summon omarchy.disk-speedtest",
    "kinds": [
      "panel"
    ],
    "firstParty": true,
    "manifestPath": "/usr/share/omarchy/shell/plugins/panels/disk-speedtest/manifest.json",
    "sourceDir": "/usr/share/omarchy/shell/plugins/panels/disk-speedtest",
    "entryPoints": {
      "panel": "Panel.qml"
    },
    "barWidget": null,
    "bar": null,
    "barWidgetPath": null,
    "barPath": null
  },
  {
    "id": "omarchy.dropbox",
    "name": "Dropbox",
    "description": "Dropbox status, storage usage, login, and recent synced files in the Omarchy bar.",
    "kinds": [
      "bar-widget"
    ],
    "firstParty": true,
    "manifestPath": "/usr/share/omarchy/shell/plugins/panels/dropbox/manifest.json",
    "sourceDir": "/usr/share/omarchy/shell/plugins/panels/dropbox",
    "entryPoints": {
      "barWidget": "Panel.qml"
    },
    "barWidget": {
      "displayName": "Dropbox",
      "description": "Log in to Dropbox, view storage usage, and open recent synced files.",
      "category": "Files",
      "allowMultiple": false,
      "defaultSection": "right",
      "defaults": {
        "refreshIntervalSec": 60
      },
      "schema": [
        {
          "key": "refreshIntervalSec",
          "type": "integer",
          "label": "Refresh interval (seconds)",
          "min": 10,
          "max": 3600,
          "step": 5,
          "defaultValue": 60
        }
      ]
    },
    "bar": null,
    "barWidgetPath": "/usr/share/omarchy/shell/plugins/panels/dropbox/Panel.qml",
    "barPath": null
  },
  {
    "id": "omarchy.emojis",
    "name": "Emojis",
    "description": "Search, copy, and type emojis",
    "kinds": [
      "overlay"
    ],
    "firstParty": true,
    "manifestPath": "/usr/share/omarchy/shell/plugins/emojis/manifest.json",